{
  "schemaVersion": 1,
  "pdf": "reference/school-exams/2026-동북고-1학년-2학기-중간-공통수학2/동북고등학교_1학년_2026_2학기중간_공통수학2_선택,공통_문제_정답.pdf",
  "referenceRoot": "C:/Users/8xnve/Documents/ReviewNotes/reference/school-exams",
  "paper": {
    "id": "2026-dongbuk-g1-s2-mid-common2",
    "title": "2026 동북고 1학년 2학기 중간 공통수학2",
    "kind": "school",
    "schoolName": "동북고",
    "year": 2026,
    "grade": 1,
    "semester": 2,
    "examTerm": "mid",
    "subject": "공통수학2",
    "source": "동북고",
    "schoolGrade": "고1",
    "examDate": null,
    "examDateNote": "원본에는 연도·학기·중간고사만 있고 정확한 시행일은 없음",
    "timeLimitMinutes": 50,
    "questionCount": 21,
    "maxScore": 100,
    "electives": [],
    "published": false
  },
  "slug": "dongbuk",
  "migrationTimestamp": "20261003070000",
  "curriculumGrade": "공통수학2",
  "questions": [
    {
      "number": 18,
      "answerType": "choice10",
      "answer": "7",
      "choices": [
        "\\frac{\\sqrt{23}}{2}",
        "\\sqrt{41}",
        "\\sqrt{105}",
        "23",
        "\\sqrt{39}",
        "4\\sqrt{3}",
        "\\sqrt{23}",
        "2\\sqrt{23}",
        "\\frac{\\sqrt{23}}{4}",
        "8"
      ],
      "originalAnswer": "\\sqrt{23}",
      "distractorReasons": [
        "현의 반길이를 답함",
        "두 중심 사이 거리를 답함",
        "피타고라스에서 빼기 대신 더하기",
        "제곱근 누락",
        "중심 거리의 y성분 누락",
        "중심 거리의 x성분 누락",
        "정답",
        "현 길이에 2를 다시 곱함",
        "중심 거리와 현 길이를 각각 추가로 반으로 줄임",
        "두 원의 교점을 지름 양 끝점으로 생각함"
      ],
      "sourceAnswerText": "\u0001 \n"
    }
  ],
  "chapters": {
    "1": "평면좌표",
    "2": "평면좌표",
    "3": "직선의 방정식",
    "4": "직선의 방정식",
    "5": "평면좌표",
    "6": "원의 방정식",
    "7": "원의 방정식",
    "8": "원의 방정식",
    "9": "도형의 이동",
    "10": "도형의 이동",
    "11": "원의 방정식",
    "12": "원의 방정식",
    "13": "원의 방정식",
    "14": "집합",
    "15": "집합",
    "16": "집합",
    "17": "집합",
    "18": "원의 방정식",
    "19": "평면좌표",
    "20": "원의 방정식",
    "21": "집합"
  }
}
